Datetime,Tweet Id,Username,Text
2020-02-10 15:27:59+00:00,1226890563699531778,_yeathatselle,Blac Chyna is naturally pretty. She didn’t even have to touch her face 🥴
2020-02-10 15:26:20+00:00,1226890149772001285,MsSonta3,"If you're gonna crash a party, do it in this dress! The REAL reason Blac Chyna walked the red carpet at the 2020 Oscars https://t.co/1NT6NdzS0F"
2020-02-10 15:24:12+00:00,1226889610862657537,sagesurge,"Y'all bitched and moaned about Academy Award winner Eminem performing at the Oscars but didn't say shit about Black Chyna being at the Oscars.

#OscarSunday #Oscarsredcarpet #Oscar2020 #Oscars2020 #OSCAR #Oscars https://t.co/ERxuimOlgL"
2020-02-10 15:23:38+00:00,1226889469355102208,Valerie6991,"@billyeichner Who said out loud, “you know who we should invite? Blac Chyna, of course.” And then someone else actually agreed..."
2020-02-10 15:23:34+00:00,1226889451579871232,bigcoolinn,Blac Chyna 100 percent does some heavy drugs sorry.
2020-02-10 15:21:50+00:00,1226889014147518465,AbpArias,i still want a date with blac chyna
2020-02-10 15:21:33+00:00,1226888945335664641,Dopechick_Chyna,@DJ_Ju__ 😂😂😂😂😂😂😂 fuck around head be stuck in the headboard like Gina😂😂😂😂
2020-02-10 15:21:05+00:00,1226888828801232898,__leshh,Blac chyna came whole new jaw bone.. that’s scary
2020-02-10 15:20:02+00:00,1226888561225584641,TheYBF,OSCARS 2020: Spike Lee Pays Respect To Kobe Bryant + Regina King (Best Dressed!) Gets Kissy With Brad Pitt + Blac Chyna Somehow Got An Invite https://t.co/ITiA3SuwY3
2020-02-10 15:17:27+00:00,1226887912257654784,_MarioDaComic_,@Tricey_J_ @dachosen1_chyna No I do I shouldn’t never left em 😢😢😢😢😢
2020-02-10 15:16:47+00:00,1226887744837816321,DINOmsindo,It's really blasphemous to mention Blaq Chyna and Kim K in the same breath wtf
2020-02-10 15:16:44+00:00,1226887730866610178,APDub,Blac Chyna trying to get that Oscar money. She got something up her sleeve
2020-02-10 15:16:12+00:00,1226887599534551045,LesleyHauler,@gibsonoma Wait but I mean Blacc Chyna?
2020-02-10 15:15:51+00:00,1226887511529517059,Starbucks,"@DowellChyna We've got you covered, Chyna - come on in and get it! 😉"
2020-02-10 15:15:11+00:00,1226887342256017409,Dopechick_Chyna,@DJ_Ju__ Yooooo shit crazy😂😂😂
2020-02-10 15:14:42+00:00,1226887220021297152,DJ_Ju__,@Dopechick_Chyna Thought I was the only one 😂😂😂🤦🏾‍♂️
2020-02-10 15:14:39+00:00,1226887207270715392,BETNews,"Wayment...does Blac Chyna actually have people working harder than Kris Jenner??
https://t.co/lyLIbM3rkj"
2020-02-10 15:13:27+00:00,1226886906455216129,Swaggzilla_,@_MarioDaComic_ @Tricey_J_ @dachosen1_chyna The linkkkkkkkk https://t.co/1peWiI86Yo
2020-02-10 15:13:16+00:00,1226886858409463809,Dopechick_Chyna,Twitter porn be inspiring me😂😩😩
2020-02-10 15:13:07+00:00,1226886820711010304,AndiSachs,Blac Chyna is a global treasure
2020-02-10 15:12:52+00:00,1226886757515485187,ohsokaren,Blac Chyna was at the oscars and was allowed to walk the red carpet ..... I’m confused. #TheOscars
2020-02-10 15:12:48+00:00,1226886742407512067,MoManiMoBitchez,Blac Chyna looks bad
2020-02-10 15:12:30+00:00,1226886668038393856,Tricey_J_,@_MarioDaComic_ @dachosen1_chyna Yea she belong to the Streets 🤣
2020-02-10 15:11:06+00:00,1226886315905556480,Dopechick_Chyna,I’m seriously about to open my own party store.... yesterday I spent $31 for 8 latex balloons 😩
2020-02-10 15:10:55+00:00,1226886267209691141,_MarioDaComic_,@Tricey_J_ @dachosen1_chyna It was the link 😢😢😢😢😢
2020-02-10 15:09:34+00:00,1226885930532761602,mrcefjr,"Waiment. So all the non-talented, irrelevant, non-industry white folks that show up to the Oscars every damn year but Blac Chyna’s presence is “shocking” and news worthy? 🙄 https://t.co/2fyb5UsykJ"
2020-02-10 15:09:17+00:00,1226885857673719813,chyna______,Work is dragggging me today.
2020-02-10 15:05:11+00:00,1226884826441101312,ChrisTurntUp_,So why was black chyna at the oscars?
2020-02-10 15:05:07+00:00,1226884809395449858,ShariWasHere,"Fr tho, why was black chyna at the Oscars??"
2020-02-10 15:02:49+00:00,1226884228169764864,ItsHippyPotter,"the question isn’t why is Blac Chyna at the Oscars, the real question is why are you not 🥴"
2020-02-10 15:02:44+00:00,1226884208838221824,DismalAbysmal,"@JFiWRAL @CeeHawk I was still wrapped up in Eddie being a WCW cruiserweight, a tag team guy and sometimes mid-card comedy act (dating Chyna, ""lie, cheat &amp; steal"" bits)

But, of course, I eventually got over that."
2020-02-10 15:01:36+00:00,1226883925630488584,Chyna_Renae,My coworkers are awesome!
2020-02-10 15:01:25+00:00,1226883878364811266,Tricey_J_,@dachosen1_chyna Was it the link r the patty 🤣
2020-02-10 15:00:34+00:00,1226883664438595585,__missronnie,I haven’t seen Chyna in 6 months I’m surprised I remember what she look like 😭
2020-02-10 15:00:29+00:00,1226883643869581312,B69Norm,She didn't wait an hour after eating to go swimming. My girl Chyna. @ Norms Zoo https://t.co/vsqr2PhgiE
2020-02-10 14:59:35+00:00,1226883414734856192,G5Blanco,I don’t know what it is about Blac Chyna but she look funny as heck to me I think it’s her Angela Basset check bones Kylie Jenner lips and Kardashian complexion that’s throwing me off 🤦🏽‍♀️🤷🏽‍♀️🤧
2020-02-10 14:59:00+00:00,1226883270559715331,BisekutDinda,@mohsyahnizam chink
2020-02-10 14:57:15+00:00,1226882827981086720,Mirandom88,Why was Blac Chyna at the Oscars?
2020-02-10 14:56:12+00:00,1226882566696919041,Kel_ot,Why was blac Chyna at the oscars?
2020-02-10 14:54:45+00:00,1226882197925138433,NoyahKing,Blac Chyna look crazy in the face
2020-02-10 14:52:04+00:00,1226881524995444736,Gillian_Sauter,Why was Blac Chyna at the Oscars?
2020-02-10 14:51:39+00:00,1226881419806273536,bornboujee,remind me again why Blac Chyna was at the Oscars?????
2020-02-10 14:51:20+00:00,1226881340584452097,DavidTCDavies,"🚗 Chepstow bypass update 🚙 

❎  Bad news; bypass not considered a priority by Western Gateway STB Board

✅ Small chink of good news; @GlosCC agrees to part-fund WelTAG2 study

❓Possible hint; bypass could be looked at after 2025, although this is still too far in the future https://t.co/23EmpWpDsw"
2020-02-10 14:47:48+00:00,1226880452339937282,sarahkistler,dude black chyna’s lips are like.. too mfing big 🤨
2020-02-10 14:46:26+00:00,1226880108226588672,__chef_o,Black Chyna is starting to look like a white woman with botched surgery.
2020-02-10 14:46:22+00:00,1226880088303710210,SmokeThatPiph_,Chyna got lip fillers?
2020-02-10 14:44:35+00:00,1226879641337712642,ipayforvideos,@chyna_beee hey can you DM me got a business offer💰
2020-02-10 14:44:15+00:00,1226879556738572288,Liyyxxo,Who had the best stripper come up? Ari or Black Chyna??
2020-02-10 14:44:02+00:00,1226879501193416704,swipethemvisas,good Lord chyna that face
2020-02-10 14:43:47+00:00,1226879438526263297,__KeMontae,Blacc Chyna is so ass to me lol
2020-02-10 14:43:16+00:00,1226879310176440320,ScorpioLove_KDG,Im still trying to figure out why Black Chyna was at the Oscars and I love Eminem but why did he preform lose yourself? Lol
2020-02-10 14:42:34+00:00,1226879132589535233,Soratheshyguy,@badestbytch4u @1200World man why did blac chyna look like handsome squidward last https://t.co/hWzgLSEdpd
2020-02-10 14:41:54+00:00,1226878966939688960,Creation7La,This world is so full of Haters. Stop worrying how Blac Chyna ended up at the Oscars. You just jealous because it wasn't you. You Go Blac Chyna. Black Girls Rock🥰🤗😇💯 https://t.co/HdxnwZkPEj
2020-02-10 14:41:18+00:00,1226878815022014467,OshaKamau,Blac chyna’s Oscar face scared the shit out of me.
2020-02-10 14:39:47+00:00,1226878435122917376,chyna_mocha,"It’s so important to pursue things you love, that’ll be your only sense of satisfaction when being forced to work majority of your life"
2020-02-10 14:38:45+00:00,1226878174849462273,jsmith189,Why was Blac Chyna at the Oscars...?
2020-02-10 14:36:57+00:00,1226877719058755584,jjhatake_,Blac Chyna look like Yzma more and more everyday
2020-02-10 14:35:04+00:00,1226877248495636480,arpitamehta_,need the “who what when where why” behind blac chyna at the #Oscars
2020-02-10 14:35:00+00:00,1226877228790812672,Star104Erie,"Blac Chyna Went to the 2020 Oscars and The Internet Had Questions
https://t.co/bBAV4UQfbe"
2020-02-10 14:34:27+00:00,1226877089229393920,meydyoGaga,the only blac chyna i know is nina https://t.co/oFI7xguBWA
2020-02-10 14:32:16+00:00,1226876543248584704,reenchaa,@TheAffinityMag Nina bonina should've been blac chyna
2020-02-10 14:32:14+00:00,1226876532389564416,DJ__757,"I honestly feel bad for chyna, all that hate the GP gave her in the media is probably what caused her to get more work done"
2020-02-10 14:31:59+00:00,1226876471794270208,melancholicmex,how did Blac Chyna get invited to the oscars before Kim Kardashian ????
2020-02-10 14:31:55+00:00,1226876454710980608,AmeliaTheGingey,"If Blac Chyna gets to go, I get to go."
2020-02-10 14:29:03+00:00,1226875732321820673,lightskin_chink,What I deal with everyday😂
2020-02-10 14:28:27+00:00,1226875580529938432,Beijing_Chyna,"*comes in without my weave*

the yts: OMG did you cut your hair?! I love it! 

me: https://t.co/XZo9IfPKCC"
2020-02-10 14:28:07+00:00,1226875496346144776,PrvnceLT,Me &amp; Trell cried cuz I thought Black Chyna was Keyshia Cole 😭
2020-02-10 14:24:53+00:00,1226874682055544832,TotalTVandFilm,"4. Characters: Cast size is moderate. Major characters include: Ki-taek Kim, Ki-woo Kim, Ki-Jeong Kim, Chung sook, Dong-ik Park, Yeon-gyo, Da-hye Park, Da-song Park, Moon-gwang Gook, Yoon, Min-hyuk as well as others. Character evolution is seen in the Kim family mostly."
2020-02-10 14:24:26+00:00,1226874570663219200,kyarnbug,chyna got her matron mama morton wig and thigh out for THE academy awards
2020-02-10 14:23:37+00:00,1226874363091259392,__armaniiiiii,Blac Chyna lost it
2020-02-10 14:23:22+00:00,1226874303372677129,Chyna_Dixon,read read read learn
2020-02-10 14:23:04+00:00,1226874226864480256,brunettebarbii3,@enews Who the fuck is Blac Chyna 🤷🏼‍♀️ #GoHome
2020-02-10 14:21:50+00:00,1226873917282955264,brettenybitch,There’s a lot to be unpacked with the #Oscars but can we clarify one thing first? Why TF was blac chyna there?
2020-02-10 14:20:00+00:00,1226873455632453632,mangenchi,even if u look like u're chinese u don't get a free pass for using chink............... what's not clicking.......
2020-02-10 14:19:05+00:00,1226873223159173120,Chink_MastrFlex,Patiently waiting for the Valentine’s Day candy to go on sale
2020-02-10 14:19:02+00:00,1226873211717144577,Celebcontent,Oscars 2020: Sandra Oh and Blac Chyna among worst-dressed. https://t.co/9WOYbUyVfQ https://t.co/M7HBS0dvIS
2020-02-10 14:18:21+00:00,1226873038349664257,ZacSawyer4,"@TheRickWilson Why not? It's a chink in his armor. Can be spun as being tied to all his supposed great business acumen, tax cut grift etc. Resonates with me. Bet it would resonate with those farmers hurting in the Midwest."
2020-02-10 14:17:04+00:00,1226872717531664387,H3_2_Fine,Curious to know how Blac Chyna even gets invited to the oscars.
2020-02-10 14:16:29+00:00,1226872571603361793,BrandEyM,"Also, what was Blac Chyna doing at the Oscars?!"
2020-02-10 14:14:31+00:00,1226872073022246913,RatchYonce,Why was black chyna at the oscars?
2020-02-10 14:14:19+00:00,1226872023575670785,Kemet2MkMert,The worst look goes to....Blac Chyna's #Oscars https://t.co/YW5CIcFBcf
2020-02-10 14:12:24+00:00,1226871542715441153,_SoloDoloMofo,Blac Chyna never been fine to me man
2020-02-10 14:11:29+00:00,1226871309482762240,HannahLuxe_,But what was the point of blac chyna being at the Oscars ?
2020-02-10 14:10:45+00:00,1226871128066531340,MomagerSelina,You want to talk about industry politics.  How was blac chyna walking the red carpet at the Oscars!
2020-02-10 14:07:27+00:00,1226870296000581632,wncounseling,"Congratulations to our Technology Center of DuPage A- Team.  These students were recognized for their excellent performance in one of the many programs at TCD:

Chyna  Palmer             
Austin Reach-Menini              
Michael Rogers           
Benjamin Saline"
2020-02-10 14:07:22+00:00,1226870276287234048,Jericho_Da_MAB,@BluQuartz2 She's been on my TL 10+ times yesterday. She still gets gigs and definitely gets talked about often. Daniel Ceasar got canceled. He's literally ghost from the TL. Chyna? Hell nah lol
2020-02-10 14:06:34+00:00,1226870075187253250,SamLeterna,Who let Blac Chyna on the red carpet
2020-02-10 14:03:01+00:00,1226869179548041217,MathewJohnMusic,@Fine_Chyna_ No problem beautiful
2020-02-10 14:02:11+00:00,1226868972223705089,lissettejones_,Chyna if you don't lay off the damn plastic surgery! Her damn left titty is tryna catch up with the right titty 😂 #Oscars #chyna #plasticsurgery #fail https://t.co/uNm0Zj08nB
2020-02-10 14:00:54+00:00,1226868649216106496,JabkieNicole,Black Chyna so weird looking.
2020-02-10 14:00:16+00:00,1226868489589268482,undecidedmood,@chyna_so_wavy @_preeshaaaxox @AmourouxRomane @CAUSTICCHASER @BryceHall the accounts got suspended :/
2020-02-10 13:59:39+00:00,1226868333934497792,Kidrobt,Did we ever find out why Blac Chyna was at the Oscars?
2020-02-10 13:59:00+00:00,1226868168876007425,Daily_Express,"Blac Chyna leaves Internet baffled as to why she attended the 
#Oscars2020 https://t.co/mYNvBsrPCi https://t.co/PBGV8aQWJ9"
2020-02-10 13:58:02+00:00,1226867925262520327,CarShowDave,"Blac Chyna tops the list of worst-dressed stars at the 2020 Oscars
⁦@BLACCHYNA⁩ who is she? why is she at ⁦@Oscars2020_⁩  why should we even give a shit? Imagine what she looks like without the weave?  https://t.co/t86IcUvp7G"
2020-02-10 13:57:16+00:00,1226867732127342593,lightskin_chink,Iont trust niggas w bms😭😭
2020-02-10 13:56:48+00:00,1226867616226140160,KatieScottNews,Still wondering why blac chyna was at the #Oscars https://t.co/M7Tnqh8Vzk
2020-02-10 13:56:14+00:00,1226867475268194306,_JamesGtfo,@PopCraveMusic @PopCrave How did Blac Chyna go to the Oscars but not the Oscar nominated SZA?
2020-02-10 13:54:03+00:00,1226866922546966530,GinaStyles16,Black Chyna and Charlize Theron stole the red carpet at Oscars!!!!
2020-02-10 13:52:41+00:00,1226866579410804736,Qing_Mongol,"@Lewis30730015 @AsiasStruggles @matt07541866 @zeroman1985 Anyways, racial slurs for East/Southeast Asians such as “chink”, “gook”, “zipperhead”, and so forth, are used as racial slurs for all East/Southeast Asians, regardless of ethnicity. It’s not like they know the difference between various East/Southeast Asian ethnicities."
2020-02-10 13:52:07+00:00,1226866436024434688,Chyna_Bandzz,Rise &amp;’ Grind 💫
2020-02-10 13:50:24+00:00,1226866007240777729,HelloKennedi,Blac Chyna always looks bad. Her looks are nothing but misses from the hair to the makeup to the outfit. She needs a new glam squad.
2020-02-10 13:50:04+00:00,1226865923782402048,Qing_Mongol,"@Lewis30730015 @AsiasStruggles @matt07541866 @zeroman1985 Because the US Military were also the same people that invaded, dehumanized, and destroyed the lives of people in my ancestral country at a genocidal level. It would make sense to be offended. Besides in the US, the word, “gook”, is a racial slur for both Koreans and Vietnamese."
2020-02-10 13:49:17+00:00,1226865723873660929,theeZane,"Blac Chyna looks like the Saw mask, smh"
2020-02-10 13:48:09+00:00,1226865439306698756,BigAl_5,"Can some explain to me why Blac Chyna was at the Oscars, let alone the red carpet?"
2020-02-10 13:47:57+00:00,1226865388526460933,OceanPopNews,Black Chyna Unveils New Surgically Enhanced Chin At Oscars!! https://t.co/bUHWunmsA9 https://t.co/Xk0lpeuCsr
2020-02-10 13:46:51+00:00,1226865113027747840,GinaStyles16,"Blac Chyna Walks the 2020 Oscars Red Carpet and the Internet Is Confused https://t.co/NYneTBvHJR 
 Why?  internet-is-confused/2306764/?_osource=db_npd_nbc_knbc_twt_shr"
2020-02-10 13:46:49+00:00,1226865103083053056,Fine_Chyna_,Thanks😘😘
2020-02-10 13:46:49+00:00,1226865102529454080,blacc___chyna,@CatwalkDarling jus my type
2020-02-10 13:46:28+00:00,1226865017921921025,Fizzstah,Someone tell the Daily Mail it's either Blac Chyna or Chyna.  Every time they refer to her as Blac it irks me
2020-02-10 13:46:23+00:00,1226864994307858433,Lurcan521,"""You can never teach what you don't know. You can never give what you don't have.""
#chink+ 
#InspirationalQuotes"
2020-02-10 13:45:06+00:00,1226864672336379904,GoldieLOXZ,i don’t know how blac chyna got an invite to the oscars but 🤩🔥*she was striking different yesterday. i didn’t realize..
2020-02-10 13:44:44+00:00,1226864578388209664,blacc___chyna,@iwanimawocha @ellevargaz same
2020-02-10 13:44:35+00:00,1226864542023634944,louiscalder322,So did we ever confirm why Blac Chyna was at the #Oscars ?
2020-02-10 13:44:22+00:00,1226864485983563782,jacobpinoy,What was Blac Chyna doing at the Oscar's?
2020-02-10 13:43:46+00:00,1226864337358331905,_itsme_Brittany,Why is the Oscars guest list so cringeworthy...what movies were the Khardashians and Blacc Chyna in?
2020-02-10 13:42:17+00:00,1226863963297796097,blacc___chyna,@yungwallker @BreeanyciaM faggett
2020-02-10 13:39:28+00:00,1226863254913241090,Dezz_92,Why was blac chyna at the Oscar’s
2020-02-10 13:36:53+00:00,1226862605014327296,_BaitlessPOOTIE,I hope blac chyna eases up on the plastic surgery. She’s naturally beautiful.
2020-02-10 13:35:10+00:00,1226862171059052545,Ken_Nuke,Blac Chyna too weak to me lbs
2020-02-10 13:34:32+00:00,1226862012489175040,MathewJohnMusic,@Fine_Chyna_ Pretty
2020-02-10 13:32:47+00:00,1226861573131489282,benitaamalina,"@itsaldtr @akbarhprabowo The article says: ""Chyna has not explained her presence at the Oscars, but did share close-up videos of her look on her Instagram Story."" My assumption: it's all for Instagram Story content's sake. 😬"
2020-02-10 13:32:14+00:00,1226861432723165185,MARTYvalenTINA,Iont like how folks kept asking how did Blac Chyna get invited to the Oscars!
2020-02-10 13:31:46+00:00,1226861315181821952,LADI_CHYNA,You are purposeful in your communications and could encounter ... More for Cancer https://t.co/CLUYt65boS
2020-02-10 13:31:17+00:00,1226861193647837187,I_Am_marwa,@Silver_chyna Thanks
2020-02-10 13:27:25+00:00,1226860221735342081,chyna_j,Andrew and the CTA https://t.co/aoZWZO0n5a
2020-02-10 13:26:56+00:00,1226860100159234050,Silver_chyna,@I_Am_marwa Sorry
2020-02-10 13:26:48+00:00,1226860065623330821,LaceyDee_,Ciara looked gorgeous lastnight ... Chyna on the other hand 😐
2020-02-10 13:25:22+00:00,1226859703902330880,Txry_1k,@UmWhatsHerName Appreciate it Chyna 💯
2020-02-10 13:23:45+00:00,1226859297231032321,phreakops,Hollywood literally wetting their pants over a gook winning.
2020-02-10 13:23:34+00:00,1226859254134472704,ClickySound,https://t.co/MQTpj2M0WH  Source: Jeff Kravitz / Getty Blac Chyna Was At The Oscars?! The Oscars is the night of the stars. It's where the... https://t.co/MxHGYKSuby
2020-02-10 13:22:39+00:00,1226859020641763334,cjzisi,@HarrisonSmith85 Blac Chyna? Black Plague China? Corona Virus China? She's the modern day Grim Reaper
2020-02-10 13:22:10+00:00,1226858902614106112,Missskitttin,@PinkMist98 @MTVNEWS Why was Blac Chyna there???
2020-02-10 13:22:08+00:00,1226858893227130881,benitaamalina,"@itsaldtr Even this savage headline says it all: ""Blac Chyna Walks the 2020 Oscars Red Carpet and the Internet Is Confused"" https://t.co/vABT2OAXsd"
2020-02-10 13:20:22+00:00,1226858447792148484,SammSev,@fyeahtv Billie Eilish is doing this song for the next James Bond so that kind of makes sens. But Blac Chyna I don’t know🤷🏾‍♀️
2020-02-10 13:19:47+00:00,1226858299456401409,downtoDT,@wickedopinionz Oh. Chyna. Duh.
2020-02-10 13:17:08+00:00,1226857635279851520,photohuang,Oscars 2020 most outrageous dresses from Billie Eilish to Blac Chyna https://t.co/RJxvcoDcqu
2020-02-10 13:16:28+00:00,1226857465616179200,ExhaleRadio,#NowPlaying: Anthony Hamilton - Chyna Black Tune In: https://t.co/iG1pdoToHV
2020-02-10 13:15:25+00:00,1226857202725609473,CoachRKennedy,"@SpenceS1324 made in China
Black Chyna, Black Mamba, baby mama, Lady Gaga
Wait, Rihanna, ball hard, Sinéad O'Connor,"
2020-02-10 13:11:51+00:00,1226856304737767425,Petie42885201,@HSimbad @DominiqueDWyss Hahahaha I did wonder if 'Bern' was the chink in my argument.
2020-02-10 13:11:04+00:00,1226856107378757633,bicoastalsexy,“Why Is She Here?” Blac Chyna’s Oscar Fit And Appearance Has Twitter GOING OFF https://t.co/BFq33dD0YZ https://t.co/EOkkpLBVTv
2020-02-10 13:09:12+00:00,1226855637751074816,BrevUnleashed,"In the past 10 years, only 1 US citizen won Best Director: Chazelle - La La Land. Other winners: an Englishman, a Frenchman, Chinaman, three Mexicans (total of 5 wins between them!), &amp; a South Korean. 
Shows the power &amp; love of cinema transcends borders, cultures, and languages."
2020-02-10 13:08:35+00:00,1226855483794788353,arsonvictim,“Why Is She Here?” Blac Chyna’s Oscar Fit And Appearance Has Twitter GOING OFF https://t.co/GyVPkD8wlv https://t.co/ZJUk8eoX8w
2020-02-10 13:06:55+00:00,1226855063638945792,Chynaabankss,I’m the opposite 😂😭😭 nigga my name chyna https://t.co/NPc8qd0D1i
2020-02-10 13:06:35+00:00,1226854977118842880,papersailboat,"Today on Twitter, Oscars, Oscars, Oscars, Trump, Desparate woman pleading with the US senate to redefine poverty line in heartfelt speech everyone should hear, Oscars, “Blac Chyna” (Oscars), etc"
2020-02-10 13:04:08+00:00,1226854360426086401,JerrieRotimi,@__taerg – Lmao it pained her. They just gave Chyna the belt because the last time she was on the show she didn’t win. 😤😤
2020-02-10 13:03:07+00:00,1226854107652280321,iam_urFavorite,"@iAM_YoUrDaDDy Nahhh not blac chyna she was a stripper Tyga pulled 

She didn’t because a crazy baby momma until he left her for Kylie"
2020-02-10 13:02:44+00:00,1226854009434185728,CookLVCook,Everyone's STILL puzzled as to why Blac Chyna was there last night.
2020-02-10 13:01:44+00:00,1226853759038435330,iAM_YoUrDaDDy,"Jayda, Ari, Blac Chyna, etc. all got clout for having a baby 😭😂"
2020-02-10 13:00:43+00:00,1226853503336960000,JerrieRotimi,– Justina dragged Blac Chyna on Wild n Out and her response was “but you ain’t got no ass”. 😂
2020-02-10 12:59:00+00:00,1226853069293379584,expressceleb,"Blac Chyna leaves Internet baffled as to why she attended the 
#Oscars2020 https://t.co/pLmZPLH0CP https://t.co/eHcv26okir"
2020-02-10 12:58:01+00:00,1226852822899200001,___adni,@HouseOfGingerr 100% and Kim is the OG of branding. Probably has a whole team dedicated to it and she’s even gets coached for interviews. Highly doubt Chyna has done this.
2020-02-10 12:57:19+00:00,1226852648097386496,allyprice8,"@OldClassicBrown Agreed, looking to create the footholes for someone like @HarrisWBA to make use of. Get plenty of turn with his slow left Arm chinaman"
2020-02-10 12:55:49+00:00,1226852268106035201,aleaonline,chyna is the definition of the “instagram” look gone too far .. girl coulda looked like lauren london instead looking like shes standing in a fun house mirror
2020-02-10 12:51:45+00:00,1226851247883509761,AmaMaria_,We all know why Blac Chyna isn’t and won’t be taken as seriously as Kim. Let’s move on 🥱
2020-02-10 12:51:36+00:00,1226851206296940545,AfroclecticPod,@kingfee901 I thought that was blacc chyna
2020-02-10 12:49:51+00:00,1226850766616481794,zena_jewel,I saw this photo of Blac Chyna at the Academy Awards and I couldn't help but fucking think that she looked JUST like handsome Squidward. Y'all tell me if I'm wrong. 👀😂😂 https://t.co/KsrEi0DumY
2020-02-10 12:47:46+00:00,1226850244488503296,ThatSnitch,"Blac Chyna snags an invite to the Academy Awards https://t.co/FDbUlBgBbo
#BlacChyna #Oscar2020 #OscarsAllAccess #AcademyAwards"
2020-02-10 12:46:35+00:00,1226849945724051456,squizymm,@KiberuPtr Actually that moment was the first chink in the armor. Shit just crumbled after that. I realized guys were freestyling
2020-02-10 12:45:56+00:00,1226849784234938369,designby_s,"@httpEra404 @MrMeeds Still doesn’t make her a sex worker cos she distributed one tape benefitted from it and never done it again, no consistent work rate as a sex worker since ... Chyna on the other has a whole Cv"
2020-02-10 12:45:29+00:00,1226849670196011008,Keishdondadda,i need to fill Chyna up now while im out .
2020-02-10 12:45:07+00:00,1226849576717471744,alexammy19,Chyna news and entertainment ata ipapalit
2020-02-10 12:42:30+00:00,1226848916475437061,beauxcoco,@Nalliekah Not to mention she had two other sisters she can lean on two. Kris built a whole empire. Chyna gotta do everything by herself
2020-02-10 12:41:13+00:00,1226848594147315712,MWANGI471033,"@Wakabando If we had a government that cared about ordinary Kenyans, not the illegitimate one full of MPs who shoots Kenyans while their colleagues clap and mute I would have hope that the chinaman will be realised with a fine more than khs20,000 and a trip back home"
2020-02-10 12:40:18+00:00,1226848365046042625,Dorite_john,@1of1Chyna @waydamin Chyna dis was the perfect comment cause that shit country af but she bad af so it evens it out
2020-02-10 12:38:38+00:00,1226847945149956097,nubly_3021,Gook bbong drunken https://t.co/rG2Os4EGGx
2020-02-10 12:36:58+00:00,1226847526038450178,KG95Variety,Twitter was confused as to why Blac Chyna showed up to walk the 2020 Oscars red carpet https://t.co/1VB5Se18DL
2020-02-10 12:34:49+00:00,1226846984650338304,Bijaii,"@Messybaldyy Blac Chyna was there? Why? Isn’t there an award show for reality tv, I believe it’s called BET?"
2020-02-10 12:32:48+00:00,1226846477877563398,Its_Chyna_Baby1,You are bemused by your relationships today as your best frien... More for Virgo https://t.co/IqmzRoeBpH
