Datetime,Tweet Id,Username,Text
2020-02-10 23:58:56+00:00,1227019146795388928,ShawnaThaDoll,damn blac chyna need to go on #botched &amp; get that jawline softened up.
2020-02-10 23:58:48+00:00,1227019115275091968,vvsblazedup,blac chyna’s original face &gt;&gt;&gt;
2020-02-10 23:58:33+00:00,1227019050116669440,AGlitterTrap,What did Chyna do to her face..?! I want her to click the undo button.. ASAP
2020-02-10 23:58:17+00:00,1227018983498375170,c_i_m_o_l,"Many people say if Kyuhyun similar to the artist
Choi Sung Gook. He said his teeth and his smile
is similar to Choi Sung Gook."
2020-02-10 23:58:14+00:00,1227018972865814529,idgimaddy,Does anyone know why blac Chyna was at the Oscars yet
2020-02-10 23:57:57+00:00,1227018900413566978,suave_111,My sis be roasting so much ppl on shaderoom blac chyna blocked her
2020-02-10 23:57:19+00:00,1227018740224667648,kmtcyaabada,@etnow @BLACCHYNA Bbc black chyna ugly eeeeh mon.
2020-02-10 23:56:45+00:00,1227018598406860802,JordanPeeleHub,Black Chyna’s red carpet appearance snubbed
2020-02-10 23:54:46+00:00,1227018101075652613,damekayla,what has blac chyna done to her face.
2020-02-10 23:53:14+00:00,1227017711886139400,usalinda,"Unable to find a chink in Bernie's armor, the establishment labels him ""unvetted."" ""The Eternally Unvetted Bernie Sanders""        https://t.co/PF0PLaPO1u"
2020-02-10 23:53:04+00:00,1227017670089945093,thevoiceofevan,CHYNA BUTLER
2020-02-10 23:51:06+00:00,1227017178852950017,BadGalSkizzy,Maaann chyna girl chill with the Surgery 😣why her face look like that now
2020-02-10 23:49:32+00:00,1227016781488771072,PartiPants27,Was Blac Chyna able to get inside @TheAcademy awards show? I guess it doesn’t matter. She’s got us talking about her
2020-02-10 23:48:16+00:00,1227016463984128000,Shawtyy_T,Now why chyna do that to her face 🥴 https://t.co/qotUu88hci
2020-02-10 23:47:34+00:00,1227016286137470976,AYOONeneiana,I love Chyna bad that’s real life my sister 🤞🏽💯
2020-02-10 23:47:32+00:00,1227016278004707330,chinchillachubb,Black Chyna look like The Mask
2020-02-10 23:47:21+00:00,1227016231783321600,WE_WUZ_EVERONE,"Healthy young Chinaman goes outside, gets the sniffles starts coughing, doesn't feel good but doesn’t go home - PLAGUE. Many such cases!

https://t.co/A2ThIGcMq2"
2020-02-10 23:46:54+00:00,1227016121754275840,Kirsh_TLFO,"Just watched Power, Tasha a gook lmao"
2020-02-10 23:44:39+00:00,1227015555586064384,_theeintrovert,people on Facebook saying they’ll pray for Blac Chyna because she got her chin done
2020-02-10 23:43:57+00:00,1227015379257569281,SmartLadyLab,"Blac Chyna: Shows Up at the Oscars
Me: ?????
The Oscars: I thought y'all wanted DivERsitY? https://t.co/cALfK5YtO3"
2020-02-10 23:43:40+00:00,1227015305546915845,laurendevivio,It's been 24 hours and there still hasn't been an explanation as to why Blac Chyna was at the #oscars
2020-02-10 23:43:39+00:00,1227015302669590528,LiaBeeyah,Y’all keep saying why was Chyna at the oscars well why was the Kardashian &amp; Jenners there 🙄😒
2020-02-10 23:43:26+00:00,1227015248684646400,SageBiggaveli,@Edward_4DHands You seen black chyna?
2020-02-10 23:42:37+00:00,1227015040018124804,Phil__Accio,GOOK SH!T
2020-02-10 23:41:37+00:00,1227014788791906305,tokyo2times,Did Kylie try harder to look like Blac Chyna or did Blac Chyna try harder to look like Kylie?
2020-02-10 23:41:09+00:00,1227014673335226368,SplitJones,"@_TrendWay @IamAnnyRobert Hold ap 

Is one of them meant to be black chyna 🧐🤨"
2020-02-10 23:39:49+00:00,1227014335861489676,ItsJust_Cee,Oh chyna 😳🥺🥴
2020-02-10 23:38:56+00:00,1227014114628661248,JamesFluker,"Me, upon realising Blac Chyna somehow managed to attend the Academy Awards: https://t.co/r2NKHew0VV"
2020-02-10 23:38:03+00:00,1227013893878362117,zilzie_,bruh who tf is inviting blac chyna to everything???? what does she even do? post on Instagram???? ok then where’s my invite?
2020-02-10 23:37:31+00:00,1227013759664656384,angry_squid,"@ThePerezHilton Sometimes, it’s best to leave the old Chyna in the cupboard...."
2020-02-10 23:36:02+00:00,1227013387030319105,Anti_Moody,What did Blac Chyna do to her face?!🥴
2020-02-10 23:35:20+00:00,1227013209342849024,_neaux_,Blac Chyna went and and got her head sculpted to look like a piece of cheese toast
2020-02-10 23:35:01+00:00,1227013129495814154,OKMagazine,Did Kim Kardashian and Kylie Jenner avoid an awkward run-in with Blac Chyna at the 2020 #Oscars? https://t.co/YQT4xuOgrS
2020-02-10 23:33:40+00:00,1227012790952562691,PocketEmptyDave,Black Chyna is trying her hardest to be Billy Porter.
2020-02-10 23:32:47+00:00,1227012566129483776,envy_mfb,Black Chyna could pass off as Bobrisky. No cap
2020-02-10 23:32:25+00:00,1227012472990785538,sheabutters,Black Chyna dead ass look like an anime character
2020-02-10 23:30:14+00:00,1227011923851563013,briasoboojie,I really don’t think Blac Chyna looked as bad as y’all are saying at the #Oscars https://t.co/WVpuRyZODJ
2020-02-10 23:28:54+00:00,1227011591973036033,Real923LA,Here's Why Blac Chyna Was At The 2020 Oscars https://t.co/fa1WYzq1OO
2020-02-10 23:28:37+00:00,1227011520543981571,PerfectlySam,Somebody in my mom group said black chyna look like the handsome squidward and I can’t unsee it 😂😂😂😂
2020-02-10 23:27:38+00:00,1227011273038213122,aliciadawn33,does blac chyna know that she look like a actual cartoon character
2020-02-10 23:27:20+00:00,1227011196408279051,thatgirlxko,I kno celebs be looking up they name on Twitter and be hurt 🤣😭y’all mean asf! i just randomly searched blac chyna
2020-02-10 23:26:46+00:00,1227011051377565702,ShyleaMJB,Blac chyna got her self looking like trash 🤦🏾‍♀️
2020-02-10 23:25:12+00:00,1227010657565974535,AGeminilove,@LeBambii Girl I thought you were responding to the Chyna tweet. But all 3 of them need to self help. 😩🤣🤣🤣
2020-02-10 23:25:08+00:00,1227010642223271939,kingLosCali,Chyna got bored one night and started using the bleaching cream she tried to sell to the public.
2020-02-10 23:25:05+00:00,1227010627517865984,971zht,Here's Why Blac Chyna Was At The 2020 Oscars https://t.co/hY1vS9QXvI https://t.co/cGvGZkfv3b
2020-02-10 23:24:11+00:00,1227010402556534784,torichantalxxo,"The way Blac Chyna pulled up to the hair show will always be funny. She looked like ""let me get this over with"""
2020-02-10 23:23:17+00:00,1227010175233646592,ShaTeraDanielle,Black Chyna new face is a no for me.
2020-02-10 23:22:40+00:00,1227010021197799425,ShyleaMJB,Okay so blac chyna look a lil scary 🤦🏾‍♀️
2020-02-10 23:22:00+00:00,1227009852452622338,KRQQ,"Blac Chyna Went to the 2020 Oscars and The Internet Had Questions

https://t.co/seAlPNwWrh"
2020-02-10 23:21:52+00:00,1227009819615297536,Swordsandcups,@ephwinslow But black chyna didn’t ?
2020-02-10 23:21:39+00:00,1227009765722574848,IMJUST_AMAZING,Blacc Chyna is a mess 🤦🏾‍♀️🥴
2020-02-10 23:21:38+00:00,1227009761880743937,yasirworldwide,Blac Chyna is pretty but sometimes she be looking like “who did the body?”
2020-02-10 23:21:27+00:00,1227009713851768837,goBuddah,Yea she tripping Chyna was bad smh
2020-02-10 23:21:24+00:00,1227009704641093634,Derika_Monaee,@DopeAss_Chyna When you really need to follow bck ✌🏽
2020-02-10 23:20:38+00:00,1227009510935429126,buscemisus,blac chyna ugly tf
2020-02-10 23:20:12+00:00,1227009401715773440,DoomBoyJr,@Starbucks @StarbucksHelp sleeping in the job. Sent a DM 30 minutes ago and nothing. Chink in the armor?
2020-02-10 23:19:53+00:00,1227009320845484032,slimfemmefatale,Blac chyna look like a damn creature
2020-02-10 23:18:30+00:00,1227008972789514245,dajonmalik,Black chyna looked better without the surgery 😐
2020-02-10 23:18:14+00:00,1227008904409894912,missBeatriiz,@Theoryofdee idk but chyna look like ... https://t.co/3eyfwyTvY7
2020-02-10 23:18:03+00:00,1227008860705054720,my995,Here's Why Blac Chyna Was At The 2020 Oscars https://t.co/uq0ZTMFPj5 https://t.co/uzOuFNssek
2020-02-10 23:17:32+00:00,1227008730564354048,Shee_chaekes,Black chyna really look like she belongs on a LEGO movie
2020-02-10 23:16:50+00:00,1227008555255042048,ScottyDrippen,All da girls I use to gook over trynna fuck wit me now 😩😂 15 year old me screaming rn 😂😂😂
2020-02-10 23:15:55+00:00,1227008323599269888,aswensenn,@ZoiHales I started to type it and though of Blac Chyna saying it 😂
2020-02-10 23:15:24+00:00,1227008193890525190,chyna______,Weirdo
2020-02-10 23:14:58+00:00,1227008083697766402,chyna______,Mfs really let social media get to them.
2020-02-10 23:14:03+00:00,1227007852281245696,_Aarion,Blac Chyna look like Annabelle now smh 😔😔
2020-02-10 23:13:24+00:00,1227007689403830272,chyna______,Stop approaching me like we on some personal shit and I don’t even know you. Find something better todo
2020-02-10 23:13:06+00:00,1227007614820769792,Lay2you,"Black chyna got a box face now. Like I understand wanting to look good but ladies, come on 🤦🏾‍♀️"
2020-02-10 23:12:31+00:00,1227007466782765059,ATee111,Blac Chyna out here lookin like Lord Farquaad https://t.co/Ym2uVmHJEy
2020-02-10 23:12:21+00:00,1227007426198556672,jaslaflare,smh blacc chyna out here looking like crimson chin 2.0... this what happen when you surrounded by Yes men and not real friends smh
2020-02-10 23:12:10+00:00,1227007380707315714,Z104,Here's Why Blac Chyna Was At The 2020 Oscars https://t.co/9otLLrdqTg
2020-02-10 23:12:05+00:00,1227007359672897537,stewigail,Blacc Chyna starting to look like Lil Kim Jr.
2020-02-10 23:12:01+00:00,1227007341226274816,ermylee,@cbrelltweet Black Chyna's date?
2020-02-10 23:11:33+00:00,1227007222535815171,real1061cle,Here's Why Blac Chyna Was At The 2020 Oscars https://t.co/MDCuYgGCAY
2020-02-10 23:11:23+00:00,1227007182954270720,981WKDD,Here's Why Blac Chyna Was At The 2020 Oscars https://t.co/9XPryCIAMT
2020-02-10 23:11:17+00:00,1227007154609098752,the_fhyne_chyna,I want tha mask🥺💯
2020-02-10 23:10:49+00:00,1227007040331145216,KrownMeKing_,I remember when oomf told me Blac Chyna was her idol..
2020-02-10 23:08:42+00:00,1227006506928918529,Leee_am,The one thing blac chyna will never be able to fix is those scars from her dimple piercings.   😂
2020-02-10 23:08:37+00:00,1227006485907099648,Mr40dollars,Nah back in the day chyna was like that moe no cap
2020-02-10 23:07:19+00:00,1227006158864572417,iAM_Legend1187,"Chyna looks crazy, fam. 

Plastic surgery is the devil."
2020-02-10 23:06:39+00:00,1227005989330747392,BITCHYPRIDE,Blac chyna is snorting her face away or something cus sis giving Mask Jim Carey 😩
2020-02-10 23:06:23+00:00,1227005924935524352,molavefinds,"Attn: @DOHgovph @DOJPH @CIDG_PNP @NBIPH @LasPinasDILG @LasPinasOurHome @DepEd_PH @pcoogov @UNTVNewsRescue @PTVph Please track down these hideous people spreading #FakeNews &amp; fomenting sinophobia. My, oh my, so poor grammar &amp; generic Chinaman pic are dead giveaways. @pinas_city! https://t.co/Mr5LggmA28"
2020-02-10 23:06:07+00:00,1227005857440976896,Annastesia211,Blac chyna used to be crazy pretty who tf keeps telling her to eff up her face
2020-02-10 23:06:07+00:00,1227005856883126273,yasinbeeeeeey,"can someone do a thread on blac chyna,kim, tyga, heather sanders &amp; amber rose pls it’s too many connections &amp; too much tea."
2020-02-10 23:05:47+00:00,1227005772602671105,UrbanFashSense,OSCARS 2020: Spike Lee Pays Respect To Kobe Bryant + Regina King (Best Dressed!) Gets Kissy With Brad Pitt + Blac Chyna Somehow Got An Invite https://t.co/kxuTxxJMYj via @theybf
2020-02-10 23:05:41+00:00,1227005748456181765,FineAss_Chink,I loveeee NYX lipglosses 🥰💓
2020-02-10 23:05:41+00:00,1227005748191924224,Jamn957,Here's Why Blac Chyna Was At The 2020 Oscars #hiphop #rnb #rap #sandiego https://t.co/tZwFapuBmT
2020-02-10 23:05:14+00:00,1227005635486789633,tucker_chyna,"I need help deciding which gift to get my man for V day, so vote please!"
2020-02-10 23:05:14+00:00,1227005635457409026,I_News_N,"Right here's Why Blac Chyna was on the Oscars-&gt; https://t.co/luXg7erGCB 
#News #Breaking_News #Breaking #Latest - https://t.co/XgbRrySGMA"
2020-02-10 23:04:18+00:00,1227005400962170881,elleinad______,Blac Chyna look weird as hell with that square ass head
2020-02-10 23:02:15+00:00,1227004885461237762,DramuhBoyz,Chink Bless - Pain In Me https://t.co/XOvAtMyyK2
2020-02-10 23:01:58+00:00,1227004810056130561,1soswrld,@_haragucci @Abdulkhaaliq 😭😭 chinaman beefin the malis it’s game over
2020-02-10 23:01:33+00:00,1227004708205756417,dhaMightyQuinn,The same self hate that got to Michael Jackson is the same thing absorbing Blac Chyna.
2020-02-10 23:01:09+00:00,1227004605080449029,JtheBizDev,"Black Chyna turning herself into light skinned Michael Jackson?

😔😔😔"
2020-02-10 23:00:58+00:00,1227004559312195585,Chyna_Williams,"I just finished watching #loveisland an hour behind. I say “bye Nas” as I close the app and then come on twitter to see bye Nas is trending 😂 
How the bag has been fumbled"
2020-02-10 23:00:08+00:00,1227004349169139714,C0mplexSocieTY8,Probably the worst thing blac chyna could do was move to LA and become friends with the Kardashians
2020-02-10 22:59:55+00:00,1227004297692368896,aqueerihus,not blac chyna trynna look like kylie now 😭😭
2020-02-10 22:59:21+00:00,1227004153374945281,kingLosCali,Chyna was naturally pretty but somethings you'll never really understand
2020-02-10 22:58:19+00:00,1227003894045257729,yasinbeeeeeey,always had a love for blac chyna &amp; amber but money blinds your logic &amp; better judgment... gotta have a good team behind you.
2020-02-10 22:57:47+00:00,1227003757537484800,xoxo_Chyna,@NayAnderson_1 Blew my shit so bad🥴
2020-02-10 22:57:18+00:00,1227003638406664192,martyscorcheesy,"Blac Chyna at the Oscars, loved her in Little Women 😍😍"
2020-02-10 22:57:18+00:00,1227003636502482944,VeeAlmighty,Blac Chyna is in the running for some of the worst body dysmorphia in Black Hollyweird I've seen in a grip.
2020-02-10 22:56:57+00:00,1227003549759897600,chyna_monae,jordan did what needed to be done w these flicks. https://t.co/4x0F3Q7rRP
2020-02-10 22:56:52+00:00,1227003527303761923,Iamtheking58,Stop putting black chyna on my timeline people yall gonna give a nigga nightmare
2020-02-10 22:55:05+00:00,1227003081558118400,MFAOkpeku,"@rstoneham77 Quinn’s tweet was the 2nd or 3rd tweet I saw when I opened my Twitter app. I hadn’t even seen that she tweeted abt Blac Chyna, 1st?! Robin Roberts is royalty. She’s respected in the black community. And she’s just not the kind of woman one just picks on , &amp; w/fervor. 1/"
2020-02-10 22:55:03+00:00,1227003069675835392,Adorable_Dime,There was nothing wrong with Chyna’s face....
2020-02-10 22:54:34+00:00,1227002949420933121,OGPotRoast,Damn Blac Chyna used to be cute
2020-02-10 22:54:27+00:00,1227002919959986176,RadziwillLee,@KarenHugersMole Black Chyna belongs at the Oscars the same way Michaele  Salahi was invited to the White House.
2020-02-10 22:53:10+00:00,1227002595438403584,JusMeRae,Blac Chyna looking like Count Dracula these days and that makes me sad. I luh her 🤧
2020-02-10 22:52:25+00:00,1227002410368937990,yasinbeeeeeey,this blac chyna situation annoys me. kylie took her blueprint and bossed up. &amp; now chyna lost in the sauce.
2020-02-10 22:51:50+00:00,1227002260305141762,helloimowen,"@AOC I stopped watching the pengest munch when the kid called a store owner a ""chinaman"" and mocked his eyes."
2020-02-10 22:51:30+00:00,1227002178851790850,slappytiddies,I remember when I couldn’t tell the difference between blac Chyna and nicki Minaj
2020-02-10 22:50:47+00:00,1227001998836322305,KarenHugersMole,It's been 24 hours and we STILL DON'T KNOW WHY Blac Chyna was at the #Oscars 👇
2020-02-10 22:49:41+00:00,1227001719734853633,funnyassbigmike,Black Chyna turning into Him from the PowerPuff girls and I blame Tokyo Toni.
2020-02-10 22:49:23+00:00,1227001646007357441,kudo_renn,@FultzWes JUNGG GOOK IS DEAD NOOOO NO NO NO
2020-02-10 22:48:24+00:00,1227001396513230848,Santos12K,@joahnaven Bruh says the biggest chink 😂
2020-02-10 22:47:41+00:00,1227001218385371137,chayonatheprtty,@DopeAss_Chyna Antonio 😣 .. i call them bitches big cigarettes lol
2020-02-10 22:47:24+00:00,1227001144418979843,jetaimeDej628,"I forward everybody snap to either Rohnesha , charmus  or chyna 🤣 so when y’all come beat my ass beat they ass tooo😂😂😂"
2020-02-10 22:47:09+00:00,1227001082359926784,JamesFluker,Excuse me? Blac Chyna got to attend the Academy Awards!? Do they just let anyone in these days!?
2020-02-10 22:46:25+00:00,1227000899849064449,GoBackToAmeric1,@BritishVogue @emrata Why was Black Chyna invited tho? Like imagine Black Chyna sitting next to Al Pacino...that's weird as shit.
2020-02-10 22:46:16+00:00,1227000860783382533,UzamakiJ,"@ScyneWaive Got it in Kim K, Meg Thee Stallion, Blac Chyna, Shakira, JLo and many other flavours"
2020-02-10 22:45:57+00:00,1227000780378472448,LePetiteLeRoux,Blac chyna went out before the surgery healed with that lumpy ass face
2020-02-10 22:45:53+00:00,1227000766579212288,linzeyhoehan,Blac Chyna new face reminds me of a LEGO
2020-02-10 22:45:24+00:00,1227000644978061318,LePetiteLeRoux,Damn chyna was a ok basic looking bitch too.
2020-02-10 22:45:05+00:00,1227000563373617153,His_SmokingGun,Why would Chyna fuck her face up like that
2020-02-10 22:44:25+00:00,1227000394649362432,Def_the_Kid,"@ashakiiii She should go for the rebrand, Chyna Redd."
2020-02-10 22:41:56+00:00,1226999772336336905,DamsonsWife,Y’all seen Blac Chyna’s new face? I https://t.co/i2MC2muJ4L
2020-02-10 22:41:47+00:00,1226999731374772225,COCOA_GODD,Random AF :  But Black Chyna was at The Oscars for ??
2020-02-10 22:40:03+00:00,1226999294517039104,ABoogie315,Blacc Chyna look like she straight out of Minecraft.
2020-02-10 22:39:38+00:00,1226999191861448708,DameDiddy8,Black chyna got a head surgery? 😂 her shit look like a block now .. Chinese carry out box head ass
2020-02-10 22:39:30+00:00,1226999156323037186,Lawrenc22440621,@JStCyrTV @Jaguars @wjxt4 What are you actually talking about? Gobblety gook fool.
2020-02-10 22:38:14+00:00,1226998840508678144,QisaFenty,@datboiahmad What in the oscars blac chyna is going on
2020-02-10 22:37:43+00:00,1226998708497154048,thetrillgent,instead of making jokes let’s applaud blac chyna for her growth. she’s come a long way &amp; I respect the hustle.
2020-02-10 22:37:20+00:00,1226998611550101504,SnowwStormz,"I still wanna know how Blac Chyna made the Oscars, I’m tryna meet the connect myself 😂"
2020-02-10 22:36:56+00:00,1226998512589639686,xoxo_Chyna,My grandma called me at least 6 times today😐 I’m bout to block her.
2020-02-10 22:35:51+00:00,1226998239100047360,TheSunShowbiz,Blac Chyna flaunts tattoos at Oscars after Rob Kardashian's 'bad mom' claims https://t.co/MAESiFwQj1
2020-02-10 22:35:13+00:00,1226998082258325504,nazmraz,hey what was blac chyna doin at the oscars
2020-02-10 22:33:24+00:00,1226997621589495814,todaysreadings_,Here’s Why Blac Chyna Attended The 2020 Oscars https://t.co/Dv9peyEctA https://t.co/SGEkUQ8spj
2020-02-10 22:32:50+00:00,1226997482049146882,BevDi_S,"@CNN The show is no longer interesting, or classy, and it’s very predictable. I saw Blac Chyna on the red carpet. Blac Chyna. 😑"
2020-02-10 22:32:46+00:00,1226997463975895046,sapphireskysky,why was chyna considered worst dressed?? i thought she looked bomb asf and I RARELY ever have good things to say abt black chyna
2020-02-10 22:32:18+00:00,1226997347294613504,sadasimi,don’t forget blac chyna was promoting bleaching cream in africa
2020-02-10 22:31:36+00:00,1226997171754545155,_Britttanyyyyy,That blac Chyna scene when sis was like “embezzle” a thousand times will forget me my favorite
2020-02-10 22:30:19+00:00,1226996847501348865,BruceDeroy,@Snickers_xO_ I swear. She was very pretty. Poor Blac Chyna
2020-02-10 22:30:13+00:00,1226996823262253056,MoneeRhianna_x,Blac Chyna need to stop messing with her face and body 😩
2020-02-10 22:30:07+00:00,1226996797555519491,_ItsMarasWorld,Blac chyna looks absolutely insane.
2020-02-10 22:29:02+00:00,1226996522471940097,Santos12K,@dannyalvaness @mxllisaa Stfu you a chink
2020-02-10 22:28:47+00:00,1226996462455705600,Yessy32,"Why was Blac Chyna at the Oscars?that’s.. odd, no? 🤨"
2020-02-10 22:25:49+00:00,1226995713210507269,sensational_CYN,@LeyHova It’s a clip from black chyna and her show
2020-02-10 22:25:34+00:00,1226995651743010818,LUSE_cannon,Black Chyna was at the Oscars? https://t.co/EmltnDn85K
2020-02-10 22:23:50+00:00,1226995217007595521,xoxo_Chyna,"@_ChelsAmber Lmao fuck you😂 nah it’s cause soon as I try to sleep, everybody wanna text &amp; call ab!"
2020-02-10 22:22:33+00:00,1226994894339747840,TheBugMaiden,@Some_Chink @kirxku Good luck my boy 👍
2020-02-10 22:20:16+00:00,1226994319556534274,dope_chyna,@fk_u_mean @NICKIMINAJ Omg I’m missing it
2020-02-10 22:18:55+00:00,1226993976634433540,Chinaman_123,"@RektMoranis I read book, listen to music, go to eat my favorite food or sleep, makes me feel good."
2020-02-10 22:17:17+00:00,1226993565634613248,Chinaman_123,@CanteringClark Hear it in his voice that this is staged
2020-02-10 22:16:30+00:00,1226993370914074630,_villainciaga,@xborisr Blac Chyna bout to drop a verse
2020-02-10 22:14:47+00:00,1226992937919107072,Chink_tatyana,And I don’t give a fuck about what y’all talking about if I didn’t have kids I would be at my moms house rent fuckn free 😭😭🤷🏾‍♀️
2020-02-10 22:14:38+00:00,1226992898861871107,slimfemmefatale,Blac chyna has never been cute
2020-02-10 22:13:25+00:00,1226992595273797632,JuiceAndTitties,Blac Chyna looked way better on the left lmao
2020-02-10 22:13:25+00:00,1226992593847963651,Dizzedcom,Here’s Why Blac Chyna Was at the Oscars https://t.co/hVdS5b7MTG
2020-02-10 22:13:23+00:00,1226992587111747584,Chink_tatyana,Imma brag every time I move bitch it’s a accomplishment fuck you 😭😭
2020-02-10 22:13:23+00:00,1226992585475948544,Chink_tatyana,Y’all bitches jus be hating yea we grown we all supposed to work and support ourselves but everybody don’t. I just saw a tweet talking shit about somebody just now getting a spot of they own like shut up bitches be three kids deep at they moms or bd moms.
2020-02-10 22:13:10+00:00,1226992532153946113,S2allow,Blac Chyna was at Oscars? Some of you should be asking for your invitation come next Oscars.
2020-02-10 22:12:42+00:00,1226992412729499649,BIGcodeRed,It’s so sad what chyna did to her face she was really pretty
2020-02-10 22:11:10+00:00,1226992028866707456,Lesababy_,"I’m sorry, she look way better than blacc chyna.."
2020-02-10 22:11:01+00:00,1226991991042592768,salemwuzhere,I KNOW DAMN WELL THIS IS NOT BLACC CHYNA
2020-02-10 22:08:24+00:00,1226991331437940738,Raylene1521__,All the people that was defending Nicki about them natural over plastic comments I made have that same energy about Blac Chyna then. Bitch look like something you make on Minecraft.
2020-02-10 22:07:43+00:00,1226991158330613760,chauvin_chyna,@LilHanzSolo He had a nice ass. 🤷🏻‍♀️
2020-02-10 22:07:27+00:00,1226991092542906371,Davskieeeee_,why blac chyna chin look like a elbow now
2020-02-10 22:06:07+00:00,1226990757850030082,Curlyhairfck_,Blacc Chyna got a chin implant?? Is she okay????????
2020-02-10 22:04:17+00:00,1226990297575378944,SteveJ4530,@KjerstinSommer No doubt some chinaman will make a delicious dish out of it
2020-02-10 22:04:17+00:00,1226990296090763264,lashedbyleo,Chyna said this is me and I hate her lmfao
2020-02-10 22:04:08+00:00,1226990256060321792,rebel_sham,i wonder how much they pay blac chyna to keep posting those find out who your partner is talking to ads? please stop!
2020-02-10 22:04:01+00:00,1226990228335775744,VIPortalINC,How Blac Chyna Scored a Ticket to the 2020 Oscars – E! NEWS https://t.co/eeb88BBbXf https://t.co/LisEoUaV9e
2020-02-10 22:03:35+00:00,1226990119997116417,cityboyy_P,Black chyna out here looking like the crimson chin
2020-02-10 22:03:14+00:00,1226990029345579009,k29664911,How Blac Chyna Scored a Ticket to the 2020 Oscars – E! NEWS https://t.co/Wh13br7ica
2020-02-10 22:02:25+00:00,1226989826530070528,coverpagemag,How Blac Chyna Scored a Ticket to the 2020 Oscars https://t.co/3ejPXYfrE3
2020-02-10 21:59:57+00:00,1226989207081668614,CourtneeHendrix,When folks discuss celebs with bad plastic surgery the very first person I think of is b chyna
2020-02-10 21:59:23+00:00,1226989061891641349,WWEMatchBot,Chyna defeats The Bludgeon Brothers via intentional count-out in a LumberJill Match on NXT
2020-02-10 21:59:23+00:00,1226989060364931073,bigshitxtalker,I always thought chyna was pretty back in the day days. https://t.co/dflGya74nn
2020-02-10 21:58:48+00:00,1226988915728551938,laceymorgbby,they said “ black chyna just gone turn into Kylie Jenner huh?”😂😂😂😂😂😂😂😂 dying
2020-02-10 21:58:44+00:00,1226988899878260737,cool_tr3,This side by side of Old Blac Chyna vs now is creeping me out.
2020-02-10 21:54:10+00:00,1226987748910759937,_mamacyta,Blac chyna doing her chin was absolutely unnecessary 😭😭😭
2020-02-10 21:52:33+00:00,1226987341530701826,shelbyelby_20,Okay but has anyone figured out why Blac Chyna was at the oscars???? Still puzzled
2020-02-10 21:51:14+00:00,1226987012244115456,theylovinv,why blac chyna look like that?
2020-02-10 21:50:49+00:00,1226986908653363201,YouGottaLaugh_,@Cookie__M0nster @SlimWyldNReklez That’s White Chyna
2020-02-10 21:50:32+00:00,1226986833680179202,JTC_73,@PiruBody @itsstilltru LMFAOOOOOOOOOOOOOO YO BRO WASSUP WIT SHORTY SHE A GROWN ASS MAN CHYNA IN THE MIND ASS https://t.co/Q1OUsBS8GZ
2020-02-10 21:47:52+00:00,1226986162499309570,xoxonikkinik,Chyna baby leave your face alone.
2020-02-10 21:46:33+00:00,1226985831883210752,timgephart,"@BellaPelosi You know, Blac Chyna😂"
2020-02-10 21:43:56+00:00,1226985175025954821,EvyBaby,I’m sorry but Blac Chyna is not cute to me lol
